title,ISBN,author,genre,rating,number_of_ratings,number_of_reviews,pages,format,publish info,description,Votes
Serenity: Poems,ISBN not found,F.S. Yousaf,"Poetry, Romance, Fiction, Contemporary",3.75,947,182,144,Paperback,"First published March 1, 2022","Soft spoken yet powerful, Serenity perfectly captures the constant battle of fear and courage that lives within us.The seeds of Serenity were planted in F.S. Yousaf’s last collection of poetry, Sincerely . Struck by inspiration and overwhelmed by the response of dedicated fans, Yousaf wanted to continue this journey in a new collection. While tales of longing, uncertainty, and loss flow through each poem, Yousaf artfully captures the eternal question of how to face pain with courage and quiet resilience.Featuring 140 poems and accompanying illustrations, Serenity is the perfect escape from daily life, helping readers refocus energy and kindness toward themselves and their cherished relationships. ",13223
On Sun Swallowing,ISBN not found,Dakota Warren,"Poetry, Feminism, Fiction, Contemporary, Horror, Adult, Short Stories",4.14,"2,157",489,Paperback,Format not specified,"First published January 1, 2022","“On Sun Swallowing is a sweet and bloody collection of poetry, dancing in the spaces between skinned knees and red wine, satin and switchblades, rosaries and Dionysian ecstasy. Her writings are haunted by the ghosts of girlhood, god/s, lovers and the landscape of childhood, but Warren is unflinching - she haunts her ghosts in return, with sharp lyricism and cutthroat vulnerability. On Sun Swallowing explores shadowy emotion, at times in a whisper, at times in a scream. Think: cheap cigarettes, even cheaper wine, and an oath to reach hell by midnight and be home in time for work in the morning.”Compiling five years of poetry, prose and journal extracts, On Sun Swallowing is the debut release of Australian poet Dakota Warren. Winding through unflinchingly raw snapshots of her youth, Warren’s words are accompanied by original illustrations from Lydia Stone and curated photography from Francesca McConnell, Caroline Dare, Leche de Arte and Clara Slewa.",11747
And Yet: Poems,ISBN not found,Kate Baer,"Poetry, Nonfiction, Feminism, Adult, Audiobook, Contemporary, Womens",3.98,"5,716",858,112,Paperback,"First published November 10, 2022","The second full length poetry collection from the #1 New York Times bestselling author of What Kind of Woman.Kate Baer shot into the literary stratosphere with the publication of her debut poetry collection, What Kind of Woman,  which became an instant #1 New York Times bestseller.Kate's second full-length book of traditional poetry, And Yet, dives deeper into the themes that are the hallmarks of her writing: motherhood, friendship, love, and loss. Taken together, these poems demonstrate the remarkable evolution of a writer and an artist working at the height of her craft, pushing herself and her poetry in a beautiful and impressive way.Intimate, evocative, and bold, Kate's beguiling poetry firmly positions her in the company of Dorianne Laux, Mary Oliver, Maggie Nelson, and other great female poets of our time.",11588
"The World Keeps Ending, and the World Goes On",ISBN not found,Franny Choi,"Poetry, LGBT, Queer, Fiction, Contemporary, Audiobook, Adult",4.00,"3,443",662,144,Hardcover,"First published November 1, 2022","From acclaimed poet Franny Choi comes a poetry collection for the ends of worlds--past, present, and future. Choi's third book features poems about historical and impending apocalypses, alongside musings on our responsibilities to each other and visions for our collective survival.Many have called our time dystopian. But The World Keeps Ending, and the World Goes On reminds us that apocalypse has already come in myriad ways for marginalized peoples and calls us to imagine what will persist in the aftermaths.With lyric and tonal dexterity, these poems spin backwards and forwards in time. They look into the collective psyche of our years in the pandemic and in the throes of anti-racist uprisings, while imagining other vectors, directions, and futures. Stories of survival collide across space and time--from Korean comfort women during World War II to children wandering a museum in the future. These poems explore narrative distances and queer linearity, investigating on microscopic scales before soaring towards the universal. Throughout, Choi grapples with where the individual fits within the strange landscapes of this apocalyptic world, with its violent and many-layered histories. In the process, she imagines what togetherness--between Black and Asian and other marginalized communities, between living organisms, between children of calamity and conquest--could look like. Bringing together Choi's signature speculative imagination with even greater musicality than her previous work, The World Keeps Ending, and the World Goes On ultimately charts new paths toward hope.",10086
Bless the Daughter Raised by a Voice in Her Head: Poems,ISBN not found,Warsan Shire,"Poetry, Feminism, Nonfiction, Africa, Race, Contemporary, Audiobook",4.22,"7,302","1,201",86,Paperback,"First published March 1, 2022","Poems of migration, womanhood, trauma, and resilience from the celebrated collaborator on Beyoncé's Lemonade and Black Is King, award-winning Somali British poet Warsan Shire.Mama, I made itout of your home, alive, raised by thevoices in my head.With her first full-length poetry collection, Warsan Shire introduces us to a young girl, who, in the absence of a nurturing guide, makes her own stumbling way towards womanhood. Drawing from her own life and the lives of loved ones, as well as pop culture and news headlines, Shire finds vivid, unique details in the experiences of refugees and immigrants, mothers and daughters, Black women, and teenage girls. In Shire's hands, lives spring into fullness. This is noisy life: full of music and weeping and surahs and sirens and birds. This is fragrant life: full of blood and perfume and shisha smoke and jasmine and incense. This is polychrome life: full of henna and moonlight and lipstick and turmeric and kohl.The long-awaited collection from one of our most exciting contemporary poets, this book is a blessing, an incantatory celebration of resilience and survival. Each reader will come away changed.",8870
Woman Without Shame: Poems,ISBN not found,Sandra Cisneros,"Poetry, Feminism, Nonfiction, Memoir, Adult, The United States Of America, Audiobook",4.12,"1,791",301,176,Hardcover,"First published September 13, 2022","
A brave new collection of poems from Sandra Cisneros, the best-selling author of The House on Mango Street.
It has been twenty-eight years since Sandra Cisneros published a book of poetry. With dozens of never-before-seen poems, Woman Without Shame is a moving collection of songs, elegies, and declarations that chronicle her pilgrimage toward rebirth and the recognition of her prerogative as a woman artist. These bluntly honest and often humorous meditations on memory, desire, and the essential nature of love blaze a path toward self-awareness. For Cisneros, Woman Without Shame is the culmination of her search for home--in the Mexico of her ancestors and in her own heart.",8560
Musical Tables: Poems,ISBN not found,Billy Collins,"Poetry, Nonfiction, Humor, Adult, Literature, The United States Of America",3.79,"1,725",395,176,Hardcover,"First published November 15, 2022","A collection of more than 125 small poems, all of them new, each a thought or observation compressed to its emotional essence--from the former United States Poet Laureate and New York Times bestselling author of Aimless Love.Whenever I open a book of poems, I tend to flip through looking for the small ones. Just as I might have trust in an abstract expressionist painter if I knew he or she could draw a credible chicken, I trust poets who can go short. --Billy CollinsYou can spot a Billy Collins poem immediately. The amiable voice, the light touch, the sudden turn at the end. He puts the 'fun' back in profundity, says poet Alice Fulton. In his own words, his poems tend to start in Kansas and end in Oz.Now America's favorite poet (The Wall Street Journal) has found a new form for his unique poetic style: the small poem. Here Collins writes about his trademark themes of nature, animals, poetry, mortality, absurdity, and love--all in a handful of lines. Neither haiku nor limerick, the small poem pushes to an extreme poetry's famed power to condense emotional and conceptual meaning. Inspired by the small poetry of writers as diverse as William Carlos Williams, W.S. Merwin, Kay Ryan, and Charles Simic, and written with Collins's recognizable wit and wisdom, the more than 125 new poems of Musical Tables show one of our greatest poets channeling his unique voice into a new phase of his exceptional career.3:00 AMOnly my handis asleep, but it's a start.",8441
Poukahangatus: Poems,ISBN not found,Tayi Tibble,"Poetry, Feminism, Nonfiction, Mythology, Race, Adult, LGBT",4.12,"1,355",220,96,Hardcover,"First published July 26, 2022","The American debut of an acclaimed young poet as she explores her identity as a twenty-first-century Indigenous woman. Poem by poem, Tibble carves out a bold new way of engaging history, of straddling modernity and ancestry, desire and exploitation.Intimate, moving, virtuosic, and hilarious, Tayi Tibble is one of the most exciting new voices in poetry today. In Poūkahangatus (pronounced ""Pocahontas""), her debut volume, Tibble challenges a dazzling array of mythologies--Greek, Māori, feminist, kiwi--peeling them apart, respinning them in modern terms. Her poems move from rhythmic discussions of the Kardashians, sugar daddies, and Twilight to exquisite renderings of the natural world and precise emotions (""The lump in her throat swelled like a sea that threatened to take him from her, and she had to swallow hard""). Tibble is also a master narrator of teenage womanhood, its exhilarating highs and devastating lows; her high-camp aesthetics correlate to the overflowing beauty, irony, and ruination of her surroundings.These are warm, provocative, and profoundly original poems, written by a woman for whom diving into the wreck means taking on new assumptions--namely, that it is not radical to write from a world in which the effects of colonization, land, work, and gender are obviously connected. Along the way, Tibble scrutinizes perception and how she as a Māori woman fits into trends, stereotypes, and popular culture. With language that is at once colorful, passionate, and laugh-out-loud funny, Poūkahangatus is the work of one of our most daring new poets.",2651
The Hurting Kind: Poems,ISBN not found,Ada Limon,"Poetry, Nonfiction, Nature, Audiobook, Adult, 21st Century, American",4.35,"5,471",882,120,Hardcover,"First published May 10, 2022","An astonishing collection about interconnectedness—between the human and nonhuman, ancestors and ourselves—from National Book Critics Circle Award winner and National Book Award finalist Ada Limón.“I have always been too sensitive, a weeper / from a long line of weepers,” writes Limón. “I am the hurting kind.” What does it mean to be the hurting kind? To be sensitive not only to the world’s pain and joys, but to the meanings that bend in the scrim between the natural world and the human world? To divine the relationships between us all? To perceive ourselves in other beings—and to know that those beings are resolutely their own, that they “do not / care to be seen as symbols”?With Limón’s remarkable ability to trace thought, The Hurting Kind explores those questions—incorporating others’ stories and ways of knowing, making surprising turns, and always reaching a place of startling insight. These poems slip through the seasons, teeming with horses and kingfishers and the gleaming eyes of fish. And they honor parents, stepparents, and grandparents: the sacrifices made, the separate lives lived, the tendernesses extended to a hurting child; the abundance, in retrospect, of having two families.Along the way, we glimpse loss. There are flashes of the pandemic, ghosts whose presence manifests in unexpected memories and the mysterious behavior of pets left behind. But The Hurting Kind is filled, above all, with connection and the delight of being in the world. “Slippery and waddle thieving my tomatoes still / green in the morning’s shade,” writes Limón of a groundhog in her garden, “she is doing what she can to survive.”",2596
The Shift: Poetry for a New Perspective,ISBN not found,Melody Godfred,"Poetry, Nonfiction, Audiobook",3.78,404,88,160,Paperback,"First published January 1, 2022","The world has changed – but thankfully so have we. The Poetry for a New Perspective embodies the best of who we are now. From Melody Godfred, author of Self Love for Thinkers & Feelers , comes a collection of poems designed to reframe how we see and move through this brave new world.Each pair of poems inspires a shift from the old way of thinking to the from guilt to gratitude, resistance to surrender, and fear to love. The left side of every spread is dedicated to the old way. The right side offers a shift in perspective that lovingly illuminates the new. Each seemingly simple poem instantly elicits a profound reset, and is coupled with beautiful line drawings that awaken not just the mind, but also the heart. The Shift ’s unique poem pairings uplift the soul by offering a hopeful salve for our collective burnout. Whether you read a pair of poems a day, or consume the entire book in one sitting, The Shift will be your trusted companion as you bravely navigate the great beautiful future that lies ahead.",2521
Weaving Sundown in a Scarlet Light: Fifty Poems for Fifty Years,ISBN not found,Joy Harjo,"Poetry, Nonfiction, Feminism, Memoir, Native Americans, Race, History",4.35,734,154,160,Hardcover,"First published November 1, 2022","Over a long, influential career in poetry, Joy Harjo has been praised for her “warm, oracular voice” (John Freeman, Boston Globe) that speaks “from a deep and timeless source of compassion for all” (Craig Morgan Teicher, NPR). Her poems are musical, intimate, political, and wise, intertwining ancestral memory and tribal histories with resilience and love.In this gemlike volume, Harjo selects her best poems from across fifty years, beginning with her early discoveries of her own voice and ending with moving reflections on our contemporary moment. Generous notes on each poem offer insight into Harjo’s inimitable poetics as she takes inspiration from Navajo horse songs and jazz, reckons with home and loss, and listens to the natural messengers of the earth. As evidenced in this transcendent collection, Joy Harjo’s “poetry is light and elixir, the very best prescription for us in wounded times” (Sandra Cisneros, Millions).",1909
Alive at the End of the World,ISBN not found,Saeed Jones,"Poetry, LGBT, Queer, Nonfiction, Adult, Mental Health, Race",4.36,"2,300",368,104,Paperback,"First published September 13, 2022","Pierced by grief and charged with history, this new poetry collection from the award-winning author of 
Prelude to Bruise
 and 
How We Fight for Our Lives
 confronts our everyday apocalypses.In haunted poems glinting with laughter, Saeed Jones explores the public and private betrayals of life as we know it. With verve, wit, and elegant craft, Jones strips away American artifice in order to reveal the intimate grief of a mourning son and the collective grief bearing down on all of us.Drawing from memoir, fiction, and persona, Jones confronts the everyday perils of white supremacy with a finely tuned poetic ear, identifying moments that seem routine even as they open chasms of hurt. Viewing himself as an unreliable narrator, Jones looks outward to understand what's within, bringing forth cultural icons like Little Richard, Paul Mooney, Aretha Franklin and Diahann Carroll to illuminate how long and how perilously we've been living on top of fault lines. As these poems seek ways to love and survive through America's existential threats, Jones ushers his readers toward the realization that the end of the world is already here--and the apocalypse is a state of being.",1907
Girls That Never Die: Poems,ISBN not found,Safia Elhillo,"Poetry, Feminism, Nonfiction, Africa, Sudan, Contemporary, Religion",4.30,"1,122",189,144,Paperback,"First published July 12, 2022","Intimate poems that explore feminine shame and violence and imagine what liberation from these threats might look like, from the award-winning author of The January ChildrenIn Girls That Never Die, award-winning poet Safia Elhillo reinvents the epic to explore Muslim girlhood and shame, the dangers of being a woman, and the myriad violences enacted and imagined against women’s bodies. Drawing from her own life and family histories, as well as cultural myths and news stories about honor killings and genital mutilation, she interlaces the everyday traumas of growing up a girl under patriarchy with magical realist imaginings of rebellion, autonomy, and power.  Elhillo writes a new world: women escape their stonings by birds that carry the rocks away; slain girls grow into two, like the hydra of lore, sprouting too numerous to ever be eradicated; circles of women are deemed holy, protected. Ultimately, Girls That Never Die is about wrestling ourselves from the threats of violence that constrain our lives, and instead looking to freedom and questioning: [what if i will not die] [what will govern me then]",1831
Walking Gentry Home: A Memoir of My Foremothers in Verse,ISBN not found,Alora Young,"Poetry, Memoir, Nonfiction, History, Race, Feminism, Family",4.36,385,103,240,Paperback,"First published August 2, 2022","An ""extraordinary"" (Laurie Halse Anderson) young poet traces the lives of her foremothers in West Tennessee, from those enslaved centuries ago to her grandmother, her mother, and finally herself, in this stunning debut celebrating Black girlhood and womanhood throughout American history.""A masterpiece that beautifully captures the heartbreak that accompanies coming of age for Black girls becoming Black women.""--Evette Dionne, author of Lifting as We Climb,  longlisted for the National Book AwardWalking Gentry Home tells the story of Alora Young's ancestors, from the unnamed women forgotten by the historical record but brought to life through Young's imagination; to Amy, the first of Young's foremothers to arrive in Tennessee, buried in an unmarked grave, unlike the white man who enslaved her and fathered her child; through Young's great-grandmother Gentry, unhappily married at fourteen; to her own mother, the teenage beauty queen rejected by her white neighbors; down to Young in the present day as she leaves childhood behind and becomes a young woman.The lives of these girls and women come together to form a unique American epic in verse, one that speaks of generational curses, coming of age, homes and small towns, fleeting loves and lasting consequences, and the brutal and ever-present legacy of slavery in our nation's psyche. Each poem is a story in verse, and together they form a heart-wrenching and inspiring family saga of girls and women connected through blood and history.Informed by archival research, the last will and testament of an enslaver, formal interviews, family lore, and even a DNA test, Walking Gentry Home gives voice to those too often muted in America: Black girls and women.",1737
Normal Distance,ISBN not found,Elisa Gabbert,"Poetry, Fiction, Adult",3.71,551,131,112,Paperback,"First published September 13, 2022","A collection of funny and thought-provoking poems inspired by surprising facts that will appeal to poetry lovers and poetry haters alike from the author of the acclaimed essay collection The Unreality of Memory, “a work of sheer brilliance, beauty and bravery” (Andrew Sean Greer)Elisa Gabbert, a writer known to be both “casually brilliant” (Sandra Newman) and a “ruthless self-examiner” (Sarah Manguso) brings her “questing, restless intelligence” (Kirkus Reviews) to a new collection of poetry. By turns funny and chilling, these poems collect strange facts, interrogate language, and ask unanswerable questions that offer the pleasure of discovery on nearly every page: How does one suffer “gladly,” exactly? How bored are dogs? Which is more frightening, nothing or empty space? Was Wittgenstein sexy? With her sharp observations building to extremely quotable one-liners, the poems in this collection have an ear-wormy quality to them that’s both ultra contemporary and offers a reading experience that is at once essayistic, aphoristic, and philosophical—an invitation to eavesdrop on a mind paying attention to itself. Normal Distance is a book about thinking and feeling, meaning and experience, trees and the weather, and the boredom and pain of living through time.",1561
All the Flowers Kneeling,ISBN not found,Paul Tran,"Poetry, LGBT, Queer, Nonfiction, Race, Contemporary, Queer Lit",3.86,"1,101",219,112,Paperback,"First published February 15, 2022","
A profound meditation on physical, emotional, and psychological transformation in the aftermath of imperial violence and interpersonal abuse, from a poet both ""tender and unflinching"" (Khadijah Queen)
Visceral and astonishing, Paul Tran's debut poetry collection All the Flowers Kneeling investigates intergenerational trauma, sexual violence, and U.S. imperialism in order to radically alter our understanding of freedom, power, and control. In poems of desire, gender, bodies, legacies, and imagined futures, Tran's poems elucidate the complex and harrowing processes of reckoning and recovery, enhanced by innovative poetic forms that mirror the nonlinear emotional and psychological experiences of trauma survivors. At once grand and intimate, commanding and deeply vulnerable, All the Flowers Kneeling revels in rediscovering and reconfiguring the self, and ultimately becomes an essential testament to the human capacity for resilience, endurance, and love.",1090
Golden Ax,ISBN not found,Rio Cortez,"Poetry, Memoir, Race, African American, Westerns, American History, Audiobook",4.03,548,80,80,Paperback,"First published August 30, 2022","From a visionary writer praised for her captivating work on Black history and experience, comes a poetry collection exploring personal, political, and artistic frontiers, journeying from her family's history as Afropioneers in the American West to shimmering glimpses of transcendent, liberated futures.In poems that range from wry, tongue-in-cheek observations about contemporary life to more nuanced meditations on her ancestors--some of the earliest Black pioneers to settle in the western United States after Reconstruction--Golden Ax invites readers to re-imagine the West, Black womanhood, and the legacies that shape and sustain the pursuit of freedom.",707
Lessons in Chemistry,9780385547345.,Bonnie Garmus,"Fiction, Historical Fiction, Audiobook, Romance, Feminism, Historical, Adult",4.30,"1,237,405","111,321",390,Hardcover,"First published March 31, 2022","Alternate cover edition of ISBN 9780385547345..Chemist Elizabeth Zott is not your average woman. In fact, Elizabeth Zott would be the first to point out that there is no such thing as an average woman. But it’s the early 1960s and her all-male team at Hastings Research Institute takes a very unscientific view of equality. Except for one: Calvin Evans; the lonely, brilliant, Nobel–prize nominated grudge-holder who falls in love with—of all things—her mind. True chemistry results. But like science, life is unpredictable. Which is why a few years later Elizabeth Zott finds herself not only a single mother, but the reluctant star of America’s most beloved cooking show Supper at Six. Elizabeth’s unusual approach to cooking (“combine one tablespoon acetic acid with a pinch of sodium chloride”) proves revolutionary. But as her following grows, not everyone is happy. Because as it turns out, Elizabeth Zott isn’t just teaching women to cook. She’s daring them to change the status quo. Laugh-out-loud funny, shrewdly observant, and studded with a dazzling cast of supporting characters, Lessons in Chemistry is as original and vibrant as its protagonist.",64107
