title,ISBN,author,genre,rating,number_of_ratings,number_of_reviews,pages,format,publish info,description,Votes
Twisted Hate,ISBN not found,Ana Huang,"Romance, Contemporary, Contemporary Romance, New Adult, Adult, Audiobook, Fiction",4.01,"422,100","36,941",551,Paperback,"First published January 27, 2022","Gorgeous, cocky, and fast on his way to becoming a hotshot doctor, Josh Chen has never met a woman he couldn’t charm—except for Jules f**king Ambrose.The beautiful redhead has been a thorn in his side since they met, but she also consumes his thoughts in a way no woman ever has.When their animosity explodes into one unforgettable night, he proposes a solution that’ll get her out of his system once and for all: an enemies with benefits arrangement with simple rules.No jealousy.No strings attached.And absolutely no falling in love.**Outgoing and ambitious, Jules Ambrose is a former party girl who’s focused on one thing: passing the attorney’s bar exam.The last thing she needs is to get involved with a doctor who puts the SUFFER in insufferable… no matter how good-looking he is.But the more she gets to know him, the more she realizes there’s more than meets the eye to the man she’s hated for so long.Her best friend’s brother.Her nemesis.And her only salvation.Theirs is a match made in hell, and when the demons from their past catch up with them, they’re faced with truths that could either save them… or destroy everything they’ve worked for.Twisted Hate is a steamy enemies with benefits/enemies to lovers romance. It's book three in the Twisted series but can be read as a standalone.Warning: It contains explicit content and profanity. Recommended for 18+.",35508
Terms and Conditions,ISBN not found,Lauren Asher,"Romance, Contemporary, Contemporary Romance, Fiction, Adult, New Adult, Audiobook",4.14,"331,848","31,547",466,Paperback,"First published February 24, 2022","DeclanI’m destined to become the next CEO of my family’s media empire.The only problem? My grandfather’s inheritance clause.Fulfilling his dying wish of getting married and having an heir seemed impossible until my assistant volunteers for the job.Our marriage was supposed to be the perfect solution to my biggest problem.But the more we act in love for the public, the more unsure I feel about our contract.Caring about Iris was never part of the deal.Especially not when breaking her heart is inevitable.IrisMy plan to marry Declan was simple in theory.Move in together. Throw a wedding. Have a baby.We set rules to prevent any kind of issues.Ones that were never meant to be broken, no matter how much Declan tempts me.But what happens when our fake relationship bleeds into our real one?Falling in love was never an option.At least not for me.Terms and Conditions is the second book in a series of interconnected standalones following three billionaire brothers.",27636
"Hook, Line, and Sinker",ISBN not found,Tessa Bailey,"Romance, Contemporary, Contemporary Romance, Audiobook, Fiction, Adult, Chick Lit",3.93,"343,626","31,814",353,Paperback,"First published March 1, 2022","King crab fisherman Fox Thornton has a reputation as a sexy, carefree flirt. Everyone knows he's a guaranteed good time--in bed and out--and that's exactly how he prefers it. Until he meets Hannah Bellinger. She's immune to his charm and looks, but she seems to enjoy his... personality? And wants to be friends? Bizarre. But he likes her too much to risk a fling, so platonic pals it is.Now, Hannah's in town for work, crashing in Fox's spare bedroom. She knows he's a notorious ladies' man, but they're definitely just friends. In fact, she's nursing a hopeless crush on a colleague and Fox is just the person to help with her lackluster love life. Armed with a few tips from Westport's resident Casanova, Hannah sets out to catch her coworker's eye... yet the more time she spends with Fox, the more she wants him instead. As the line between friendship and flirtation begins to blur, Hannah can't deny she loves everything about Fox, but she refuses to be another notch on his bedpost.Living with his best friend should have been easy. Except now she's walking around in a towel, sleeping right across the hall, and Fox is fantasizing about waking up next to her for the rest of his life and... and... man overboard! He's fallen for her, hook, line, and sinker. Helping her flirt with another guy is pure torture, but maybe if Fox can tackle his inner demons and show Hannah he's all in, she'll choose him instead?In the follow-up to It Happened One Summer, Tessa Bailey delivers another deliciously fun rom-com about a former player who accidentally falls for his best friend while trying to help her land a different man...",26240
Part of Your World,ISBN not found,Abby Jimenez,"Romance, Contemporary, Fiction, Audiobook, Contemporary Romance, Adult, Chick Lit",4.30,"248,099","30,609",400,Paperback,"First published April 19, 2022","After a wild bet, gourmet grilled-cheese sandwich, and cuddle with a baby goat, Alexis Montgomery has had her world turned upside down. The cause: Daniel Grant, a ridiculously hot carpenter who’s ten years younger than her and as casual as they come—the complete opposite of sophisticated city-girl Alexis. And yet their chemistry is undeniable.While her ultra-wealthy parents want her to carry on the family legacy of world-renowned surgeons, Alexis doesn’t need glory or fame. She’s fine with being a “mere” ER doctor. And every minute she spends with Daniel and the tight-knit town where he lives, she’s discovering just what’s really important. Yet letting their relationship become anything more than a short-term fling would mean turning her back on her family and giving up the opportunity to help thousands of people.Bringing Daniel into her world is impossible, and yet she can’t just give up the joy she’s found with him either. With so many differences between them, how can Alexis possibly choose between her world and his?The New York Times bestselling author of Life's Too Short delivers a refreshingly modern fairy tale perfect for fans of Casey McQuiston and Emily Henry.",9924
You Made a Fool of Death with Your Beauty,ISBN not found,Akwaeke Emezi,"Romance, Fiction, Contemporary, LGBT, Queer, Audiobook, Adult",3.56,"46,201","8,445",288,Hardcover,"First published May 24, 2022","Fresh and seductive novel about a young woman seeking joy while healing from loss.Feyi Adekola wants to learn how to be alive again. It’s been five years since the accident that killed the love of her life and she’s almost a new person now—an artist with her own studio, and sharing a brownstone apartment with her ride-or-die best friend, Joy, who insists it’s time for Feyi to ease back into the dating scene. Feyi isn’t ready for anything serious, but a steamy encounter at a rooftop party cascades into a whirlwind summer she could have never imagined: a luxury trip to a tropical island, decadent meals in the glamorous home of a celebrity chef, and a major curator who wants to launch her art career. She’s even started dating the perfect guy, but their new relationship might be sabotaged before it has a chance by the dangerous thrill Feyi feels every time she locks eyes with the one person in the house who is most definitely off-limits. This new life she asked for just got a lot more complicated, and Feyi must begin her search for real answers. Who is she ready to become? Can she release her past and honor her grief while still embracing her future? And, of course, there’s the biggest question of all—how far is she willing to go for a second chance at love?Akwaeke Emezi’s vivid and passionate writing takes us deep into a world of possibility and healing, and the constant bravery of choosing love against all odds.",8770
Electric Idol,ISBN not found,Katee Robert,"Romance, Fantasy, Mythology, Retellings, Adult, Greek Mythology, Fiction",3.97,"93,353","9,740",375,Paperback,"First published January 18, 2022","He was the most beautiful man alive.And if I wasn't careful, he was going to be my death.*A scorchingly hot modern retelling of Psyche and Eros that's as sinful as it is sweet.*In the ultra-modern city of Olympus, there's always a price to pay. Psyche knew she'd have to face Aphrodite's ire eventually, but she never expected her literal heart to be at stake...or for Aphrodite's gorgeous son to be the one ordered to strike the killing blow.Eros has no problem shedding blood. But when it comes time to take out his latest target, he can't do it. Confused by his reaction to Psyche, he does the only thing he can think of to keep her safe: he marries her. Psyche vows to make Eros's life a living hell until they find a way out of this mess. But as lines blur and loyalties shift, she realizes he might take her heart after all...and she's not sure she can survive the loss.",8203
The Bodyguard,ISBN not found,Katherine Center,"Romance, Fiction, Contemporary, Audiobook, Contemporary Romance, Chick Lit, Adult",3.98,"235,274","33,462",309,Hardcover,"First published July 19, 2022","She's got his back. He's got her heart. They've got a secret. What could possibly go wrong?Hannah Brooks looks more like a kindergarten teacher than somebody who could kill you with her bare hands. But the truth is, she's an elite bodyguard and she's just been hired to protect a superstar actor from his stalker.Jack Stapleton's a Hollywood heartthrob - captured by paparazzi on beaches the world over, rising out of the waves in clingy board shorts and glistening like a Roman deity.When Jack's mom gets sick, he comes home to the family's Texas ranch to help out. Only one catch: He doesn't want his family to know about his stalker. Or the bodyguard thing. And so Hannah - against her will and her better judgment - finds herself pretending to be Jack's girlfriend as a cover.Protecting Jack should be easy. But protecting her own heart? That's the hardest thing she's ever done...",7740
The American Roommate Experiment,ISBN not found,Elena  Armas,"Romance, Contemporary, Contemporary Romance, Fiction, Adult, Audiobook, Chick Lit",3.83,"203,575","23,739",400,Paperback,"First published September 6, 2022","From the author of the Goodreads Choice Award winner The Spanish Love Deception, the eagerly anticipated follow-up featuring Rosie Graham and Lucas Martín, who are forced to share a New York apartment.Rosie Graham has a problem. A few, actually. She just quit her well paid job to focus on her secret career as a romance writer. She hasn’t told her family and now has terrible writer’s block. Then, the ceiling of her New York apartment literally crumbles on her. Luckily she has her best friend Lina’s spare key while she’s out of town. But Rosie doesn’t know that Lina has already lent her apartment to her cousin Lucas, who Rosie has been stalking—for lack of a better word—on Instagram for the last few months. Lucas seems intent on coming to her rescue like a Spanish knight in shining armor. Only this one strolls around the place in a towel, has a distracting grin, and an irresistible accent. Oh, and he cooks.Lucas offers to let Rosie stay with him, at least until she can find some affordable temporary housing. And then he proposes an outrageous experiment to bring back her literary muse and meet her deadline: He’ll take her on a series of experimental dates meant to jump-start her romantic inspiration. Rosie has nothing to lose. Her silly, online crush is totally under control—but Lucas’s time in New York has an expiration date, and six weeks may not be enough, for either her or her deadline.",5335
Funny You Should Ask,ISBN not found,Elissa Sussman,"Romance, Fiction, Contemporary, Contemporary Romance, Audiobook, Adult, Chick Lit",3.60,"120,148","18,156",352,Paperback,"First published April 12, 2022","Then. Twentysomething writer Chani Horowitz is stuck. While her former MFA classmates are nabbing book deals, she's in the trenches writing puff pieces. Then she's hired to write a profile of movie star Gabe Parker. The Gabe Parker--her forever celebrity crush, the object of her fantasies, the background photo on her phone--who's also just been cast as the new James Bond. It's terrifying and thrilling all at once... yet if she can keep her cool and nail the piece, it could be a huge win. Gabe will get good press, and her career will skyrocket. But what comes next proves to be life-changing in ways Chani never saw coming, as the interview turns into a whirlwind weekend that has the tabloids buzzing.Now. Ten years later, after a brutal divorce and a heavy dose of therapy, Chani is back in Los Angeles, laser-focused on one thing: her work. But she's still spent the better part of the last decade getting asked about her deeply personal Gabe Parker profile at every turn. No matter what new essay collection or viral editorial she's promoting, it always comes back to Gabe. So when his PR team requests that they reunite for a second interview, she wants to say no. She wants to pretend that she's forgotten about the time they spent together, years ago. But the truth is that those seventy-two hours are still crystal clear, etched in her memory. And so... he says yes.Chani knows that facing Gabe again also means facing feelings she's tried so hard to push away. Alternating between their first meeting and their reunion a decade later, this deliciously irresistible novel will have you hanging on until the last word.
A restless young journalist with big dreams interviews a Hollywood heartthrob--and, ten years later, it's clear that their time together meant more than meets the eye in this sexy, engrossing adult debut novel.
",5123
Thank You for Listening,ISBN not found,Julia  Whelan,"Romance, Audiobook, Fiction, Contemporary, Contemporary Romance, Chick Lit, Adult",4.01,"67,477","10,653",432,Paperback,"First published August 2, 2022","For Sewanee Chester, being an audiobook narrator is a long way from her old dreams, but the days of being a star on film sets are long behind her. She’s found success and satisfaction from the inside of a sound booth and it allows her to care for her beloved, ailing grandmother. When she arrives in Las Vegas last-minute for a book convention, Sewanee unexpectedly spends a whirlwind night with a charming stranger. On her return home, Sewanee discovers one of the world’s most beloved romance novelists wanted her to perform her last book—with Brock McNight, the industry’s hottest, most secretive voice. Sewanee doesn’t buy what romance novels are selling—not after her own dreams were tragically cut short—and she stopped narrating them years ago. But her admiration of the late author, and the opportunity to get her grandmother more help, makes her decision for her. As Sewanee begins work on the book, resurrecting her old romance pseudonym, she and Brock forge a real connection, hidden behind the comfort of anonymity. Soon, she is dreaming again, but secrets are revealed, and the realities of life come crashing down around her once more.If she can learn to risk everything for desires she has long buried, she will discover a world of intimacy and acceptance she never believed would be hers.From the author of My Oxford Year, Julia Whelan’s uplifting novel tells the story of a former actress turned successful audiobook narrator—who has lost sight of her dreams after a tragic accident—and her journey of self-discovery, love, and acceptance when she agrees to narrate one last romance novel.",4390
The Kiss Curse,ISBN not found,Erin Sterling,"Romance, Fantasy, Witches, Paranormal, Audiobook, Fiction, Contemporary",3.78,"54,386","7,482",309,Paperback,"First published September 20, 2022","Welcome to Spooky Season!! The follow-up to Erin Sterling’s New York Times bestselling hit The Ex Hex features fan favorite Gwyn and the spine-tinglingly handsome Wells Penhallow as they battle a new band of witches and their own magical chemistry.Gwyn Jones is perfectly happy with her life in Graves Glen. She, her mom, and her cousin have formed a new and powerful coven; she’s running a successful witchcraft shop, Something Wicked; and she’s started mentoring some of the younger witches in town. As Halloween approaches, there’s only one problem—Llewellyn “Wells” Penhallow.Wells has come to Graves Glen to re-establish his family’s connection to the town they founded as well as to make a new life for himself after years of being the dutiful son in Wales. When he opens up a shop of his own, Penhallow’s, just across the street from Something Wicked, he quickly learns he’s gotten more than he bargained for in going up against Gwyn.When their professional competition leads to a very personal—and very hot—kiss, both Wells and Gwyn are determined to stay away from each other, convinced the kiss was just a magical fluke. But when a mysterious new coven of witches come to town and Gwyn’s powers begin fading, she and Wells must work together to figure out just what these new witches want and how to restore Gwyn’s magic before it’s too late.",4088
Dating Dr. Dil,ISBN not found,Nisha Sharma,"Romance, Contemporary, Contemporary Romance, Fiction, Adult, Audiobook, Chick Lit",3.61,"57,364","8,815",364,Paperback,"First published March 15, 2022","Dating Dr. Dil features a love-phobic TV doctor who must convince a love-obsessed homebody they are destined to be together. Kareena Mann dreams of having a love story like her parents, but she prefers restoring her classic car to swiping right on dating apps. When her father announces he’s selling her mother’s home, Kareena makes a deal with him: he’ll gift her the house if she can get engaged in four months. Her search for her soulmate becomes impossible when her argument with Dr. Prem Verma, host of The Dr. Dil Show, goes viral. Now the only man in her life is the one she doesn’t want.Dr. Prem Verma is dedicated to building a local community health center, but he needs to get donors with deep pockets. The Dr. Dil Show was doing just that, until his argument with Kareena went viral, and he’s left short changed. That’s when Kareena’s meddling aunties presented him with a solution: convince Kareena he’s her soulmate and they’ll fund his clinic.  Even though they have conflicting views on love-matches and arranged-matches, the more time Prem spends with Kareena, the more he begins to believe she’s the woman he wants to spend the rest of his life with. But for Prem and Kareena to find their happily ever after, they must admit that hate has turned into fate. ",3180
The Wedding Crasher,ISBN not found,Mia Sosa,"Romance, Contemporary, Contemporary Romance, Fiction, Adult, Audiobook, Chick Lit",3.67,"33,112","4,481",385,Paperback,"First published April 5, 2022","The USA Today bestselling author of The Worst Best Man is back with another hilarious rom-com about two strangers who get trapped in a lie and have to fake date their way out of it...Just weeks away from ditching DC for greener pastures, Solange Pereira is roped into helping her wedding planner cousin on a random couple’s big day. It’s an easy gig... until she stumbles upon a situation that convinces her the pair isn’t meant to be. What’s a true-blue romantic to do? Crash the wedding, of course. And ensure the unsuspecting groom doesn’t make the biggest mistake of his life.Dean Chapman had his future all mapped out. He was about to check off “start a family” and on track to “make partner” when his modern day marriage of convenience went up in smoke. Then he learns he might not land an assignment that could be his ticket to a promotion unless he has a significant other and, in a moment of panic, Dean claims to be in love with the woman who crashed his wedding. Oops.Now Dean has a whole new item on his to-do list: beg Solange to be his pretend girlfriend. Solange feels a tiny bit bad about ruining Dean’s wedding, so she agrees to play along. Yet as they fake-date their way around town, what started as a performance for Dean’s colleagues turns into a connection that neither he nor Solange can deny. Their entire romance is a sham... there’s no way these polar opposites could fall in love for real, right?",1723
Sea of Tranquility,ISBN not found,Emily St. John Mandel,"Fiction, Science Fiction, Time Travel, Fantasy, Historical Fiction, Audiobook, Literary Fiction",4.08,"232,328","28,134",259,Hardcover,"First published April 5, 2022","A novel of art, time travel, love, and plague that takes the reader from Vancouver Island in 1912 to a dark colony on the moon five hundred years later, unfurling a story of humanity across centuries and space.Edwin St. Andrew is eighteen years old when he crosses the Atlantic by steamship, exiled from polite society following an ill-conceived diatribe at a dinner party. He enters the forest, spellbound by the beauty of the Canadian wilderness, and suddenly hears the notes of a violin echoing in an airship terminal--an experience that shocks him to his core. Two centuries later a famous writer named Olive Llewellyn is on a book tour. She's traveling all over Earth, but her home is the second moon colony, a place of white stone, spired towers, and artificial beauty. Within the text of Olive's best-selling pandemic novel lies a strange passage: a man plays his violin for change in the echoing corridor of an airship terminal as the trees of a forest rise around him. When Gaspery-Jacques Roberts, a detective in the black-skied Night City, is hired to investigate an anomaly in the North American wilderness, he uncovers a series of lives upended: The exiled son of an earl driven to madness, a writer trapped far from home as a pandemic ravages Earth, and a childhood friend from the Night City who, like Gaspery himself, has glimpsed the chance to do something extraordinary that will disrupt the timeline of the universe. A virtuoso performance that is as human and tender as it is intellectually playful, Sea of Tranquility is a novel of time travel and metaphysics that precisely captures the reality of our current moment.'",59920
The Daughter of Doctor Moreau,ISBN not found,Silvia Moreno-Garcia,"Historical Fiction, Horror, Fiction, Fantasy, Science Fiction, Historical, Retellings",3.58,"31,111","4,712",306,Hardcover,"First published July 19, 2022","A lavish historical drama reimagining of The Island of Doctor Moreau set against the backdrop of nineteenth-century Mexico.Carlota Moreau: a young woman, growing up in a distant and luxuriant estate, safe from the conflict and strife of the Yucatán peninsula. The only daughter of either a genius, or a madman. Montgomery Laughton: a melancholic overseer with a tragic past and a propensity for alcohol. An outcast who assists Dr. Moreau with his scientific experiments, which are financed by the Lizaldes, owners of magnificent haciendas and plentiful coffers.  The hybrids: the fruits of the Doctor’s labor, destined to blindly obey their creator and remain in the shadows. A motley group of part human, part animal monstrosities.  All of them living in a perfectly balanced and static world, which is jolted by the abrupt arrival of Eduardo Lizalde, the charming and careless son of Doctor Moreau’s patron, who will unwittingly begin a dangerous chain reaction. For Moreau keeps secrets, Carlota has questions, and in the sweltering heat of the jungle, passions may ignite.The Daughter of Doctor Moreau is both a dazzling historical novel and a daring science fiction journey.",47544
Nona the Ninth,ISBN not found,Tamsyn Muir,"Fantasy, Science Fiction, Fiction, Queer, LGBT, Horror, Lesbian",4.35,"37,927","6,244",480,Hardcover,"First published September 13, 2022","Her city is under siege.The zombies are coming back.And all Nona wants is a birthday party.In many ways, Nona is like other people. She lives with her family, has a job at her local school, and loves walks on the beach and meeting new dogs. But Nona's not like other people. Six months ago she woke up in a stranger's body, and she's afraid she might have to give it back.The whole city is falling to pieces. A monstrous blue sphere hangs on the horizon, ready to tear the planet apart. Blood of Eden forces have surrounded the last Cohort facility and wait for the Emperor Undying to come calling. Their leaders want Nona to be the weapon that will save them from the Nine Houses. Nona would prefer to live an ordinary life with the people she loves, with Pyrrha and Camilla and Palamedes, but she also knows that nothing lasts forever.And each night, Nona dreams of a woman with a skull-painted face...",35767
