title,ISBN,author,genre,rating,number_of_ratings,number_of_reviews,pages,format,publish info,description,Votes
How to Be Perfect: The Correct Answer to Every Moral Question,ISBN not found,Michael Schur,"Nonfiction, Philosophy, Audiobook, Humor, Self Help, Psychology, Comedy",4.14,"28,458","4,127",304,Hardcover,"First published January 25, 2022","From the creator of The Good Place and the cocreator of Parks and Recreation, a hilarious, thought-provoking guide to living an ethical life, drawing on 2,500 years of deep thinking from around the world.Most people think of themselves as “good,” but it’s not always easy to determine what’s “good” or “bad”—especially in a world filled with complicated choices and pitfalls and booby traps and bad advice. Fortunately, many smart philosophers have been pondering this conundrum for millennia and they have guidance for us. With bright wit and deep insight, How to Be Perfect explains concepts like deontology, utilitarianism, existentialism, ubuntu, and more so we can sound cool at parties and become better people. Schur starts off with easy ethical questions like “Should I punch my friend in the face for no reason?” (No.) and works his way up to the most complex moral issues we all face. Such as: Can I still enjoy great art if it was created by terrible people? How much money should I give to charity? Why bother being good at all when there are no consequences for being bad? And much more. By the time the book is done, we’ll know exactly how to act in every conceivable situation, so as to produce a verifiably maximal amount of moral good. We will be perfect, and all our friends will be jealous. OK, not quite. Instead, we’ll gain fresh, funny, inspiring wisdom on the toughest issues we face every day.",14071
An Immense World: How Animal Senses Reveal the Hidden Realms Around Us,ISBN not found,Ed Yong,"Nonfiction, Science, Nature, Animals, Biology, Audiobook, Environment",4.47,"22,432","3,509",464,Hardcover,"First published June 21, 2022","

A grand tour through the hidden realms of animal senses that will transform the way you perceive the world
--from the Pulitzer Prize-winning, New York Times bestselling author of I Contain Multitudes.
The Earth teems with sights and textures, sounds and vibrations, smells and tastes, electric and magnetic fields. But every animal is enclosed within its own unique sensory bubble, perceiving but a tiny sliver of an immense world. This book welcomes us into a previously unfathomable dimension--the world as it is truly perceived by other animals.We encounter beetles that are drawn to fires, turtles that can track the Earth's magnetic fields, fish that fill rivers with electrical messages, and humans that wield sonar like bats. We discover that a crocodile's scaly face is as sensitive as a lover's fingertips, that the eyes of a giant squid evolved to see sparkling whales, that plants thrum with the inaudible songs of courting bugs, and that even simple scallops have complex vision. We learn what bees see in flowers, what songbirds hear in their tunes, and what dogs smell on the street. We listen to stories of pivotal discoveries in the field, while looking ahead at the many mysteries which lie unsolved.In An Immense World, author and acclaimed science journalist Ed Yong coaxes us beyond the confines of our own senses, allowing us to perceive the skeins of scent, waves of electromagnetism, and pulses of pressure that surround us. Because in order to understand our world we don't need to travel to other places; we need to see through other eyes.",13983
Bittersweet: How Sorrow and Longing Make Us Whole,ISBN not found,Susan Cain,"Nonfiction, Psychology, Self Help, Audiobook, Mental Health, Personal Development, Philosophy",3.98,"20,897","2,590",310,Hardcover,"First published April 5, 2022","In her new masterpiece, the author of the bestselling phenomenon Quiet reveals the power of a bittersweet outlook on life, and why we’ve been so blind to its value.With Quiet, Susan Cain urged our society to cultivate space for the undervalued, indispensable introverts among us, thereby revealing an untapped power hidden in plain sight. Now she employs the same mix of research, storytelling, and memoir to explore why we experience sorrow and longing, and the surprising lessons these states of mind teach us about creativity, compassion, leadership, spirituality, mortality, and love. Bittersweetness is a tendency to states of longing, poignancy, and sorrow; an acute awareness of passing time; and a curiously piercing joy when beholding beauty. It recognizes that light and dark, birth and death—bitter and sweet—are forever paired. A song in a minor key, an elegiac poem, or even a touching television commercial all can bring us to this sublime, even holy, state of mind—and, ultimately, to greater kinship with our fellow humans. But bittersweetness is not, as we tend to think, just a momentary feeling or event. It’s also a way of being, a storied heritage. Our artistic and spiritual traditions—amplified by recent scientific and management research—teach us its power. Cain shows how a bittersweet state of mind is the quiet force that helps us transcend our personal and collective pain. If we don’t acknowledge our own sorrows and longings, she says, we can end up inflicting them on others via abuse, domination, or neglect. But if we realize that all humans know—or will know—loss and suffering, we can turn toward each other. And we can learn to transform our own pain into creativity, transcendence, and connection. At a time of profound discord and personal anxiety, Bittersweet brings us together in deep and unexpected ways.",12465
The Trayvon Generation,ISBN not found,Elizabeth Alexander,"Nonfiction, Essays, Race, History, Social Justice, Politics, Audiobook",4.36,"1,942",293,146,Hardcover,"First published April 5, 2022","From a Pulitzer Prize finalist and New York Times bestselling author and poet comes a galvanizing meditation on the power of art and culture to illuminate America's unresolved problem with race.*Named a Most Anticipated Title of 2022 by TIME magazine, New York Times, Bustle, and more*In the midst of civil unrest in the summer of 2020 and following the murders of George Floyd, Breonna Taylor, and Ahmaud Arbery, Elizabeth Alexander—one of the great literary voices of our time—turned a mother's eye to her sons’ and students’ generation and wrote a celebrated and moving reflection on the challenges facing young Black America. Originally published in the New Yorker, the essay incisively and lovingly observed the experiences, attitudes, and cultural expressions of what she referred to as the Trayvon Generation, who even as children could not be shielded from the brutality that has affected the lives of so many Black people. The Trayvon Generation expands the viral essay that spoke so resonantly to the persistence of race as an ongoing issue at the center of the American experience. Alexander looks both to our past and our future with profound insight, brilliant analysis, and mighty heart, interweaving her voice with groundbreaking works of art by some of our most extraordinary artists. At this crucial time in American history when we reckon with who we are as a nation and how we move forward, Alexander's lyrical prose gives us perspective informed by historical understanding, her lifelong devotion to education, and an intimate grasp of the visioning power of art. This breathtaking  book is essential reading and an expression of both the tragedies and hopes for the young people of this era that is sure to be embraced by those who are leading the movement for change and anyone rising to meet the moment. ",4548
Starry Messenger: Cosmic Perspectives on Civilization,ISBN not found,Neil deGrasse Tyson,"Science, Nonfiction, Philosophy, Audiobook, History, Space, Politics",4.12,"11,103","1,404",271,Hardcover,"First published September 20, 2022","Bringing his cosmic perspective to civilization on Earth, Neil deGrasse Tyson shines new light on the crucial fault lines of our time—war, politics, religion, truth, beauty, gender, and race—in a way that stimulates a deeper sense of unity for us all.In a time when our political and cultural views feel more polarized than ever, Tyson provides a much-needed antidote to so much of what divides us, while making a passionate case for the twin chariots of enlightenment—a cosmic perspective and the rationality of science.After thinking deeply about how science sees the world and about Earth as a planet, the human brain has the capacity to reset and recalibrates life’s priorities, shaping the actions we might take in response. No outlook on culture, society, or civilization remains untouched.With crystalline prose, Starry Messenger walks us through the scientific palette that sees and paints the world differently. From insights on resolving global conflict to reminders of how precious it is to be alive, Tyson reveals, with warmth and eloquence, an array of brilliant and beautiful truths that apply to us all, informed and enlightened by knowledge of our place in the universe.",4208
"Rogues: True Stories of Grifters, Killers, Rebels and Crooks",ISBN not found,Patrick Radden Keefe,"Nonfiction, True Crime, History, Crime, Audiobook, Essays, Short Stories",4.01,"15,202","1,727",368,Hardcover,"First published June 28, 2022","From the prize-winning,  New York Times bestselling author of Say Nothing and Empire of Pain, twelve enthralling stories of skulduggery and intrigue by one of the most decorated journalists of our time.Patrick Radden Keefe has garnered prizes ranging from the National Magazine Award to the Orwell Prize to the National Book Critics Circle Award for his meticulously reported, hypnotically engaging work on the many ways people behave badly. Rogues brings together a dozen of his most celebrated articles from The New Yorker. As Keefe says in his preface, ""They reflect on some of my abiding preoccupations: crime and corruption, secrets and lies, the permeable membrane separating licit and illicit worlds, the bonds of family, the power of denial.""Keefe brilliantly explores the intricacies of forging $150,000 vintage wines, examines whether a whistleblower who dared to expose money laundering at a Swiss bank is a hero or a fabulist, spends time in Vietnam with Anthony Bourdain, chronicles the quest to bring down a cheerful international black market arms merchant, and profiles a passionate death penalty attorney who represents the ""worst of the worst,"" among other bravura works of literary journalism.The appearance of his byline in The New Yorker is always an event, and collected here for the first time readers can see his work forms an always enthralling but deeply human portrait of criminals and rascals, as well as those who stand up against them.",3646
The Song of the Cell: An Exploration of Medicine and the New Human,ISBN not found,Siddhartha Mukherjee,"Science, Nonfiction, Biology, Medicine, History, Health, Medical",4.29,"10,188","1,314",473,Hardcover,"First published October 25, 2022","Winner of the 2023 PROSE Award for Excellence in Biological and Life Sciences and the 2023 Chautauqua Prize!N amed a New York Times Notable Book and a Best Book of the Year by The Economist , Oprah Daily, BookPage, Book Riot, the New York Public Library, and more!In The Song of the Cell , the extraordinary author of the Pulitzer Prize–winning The Emperor of All Maladies and the #1 New York Times bestseller The Gene “blends cutting-edge research, impeccable scholarship, intrepid reporting, and gorgeous prose into an encyclopedic study that reads like a literary page-turner” ( Oprah Daily ).Mukherjee begins this magnificent story in the late 1600s, when a distinguished English polymath, Robert Hooke, and an eccentric Dutch cloth-merchant, Antonie van Leeuwenhoek looked down their handmade microscopes. What they saw introduced a radical concept that swept through biology and medicine, touching virtually every aspect of the two sciences, and altering both forever. It was the fact that complex living organisms are assemblages of tiny, self-contained, self-regulating units. Our organs, our physiology, our selves—hearts, blood, brains—are built from these compartments. Hooke christened them “ cells. ”The discovery of cells—and the reframing of the human body as a cellular ecosystem—announced the birth of a new kind of medicine based on the therapeutic manipulations of cells. A hip fracture, a cardiac arrest, Alzheimer’s dementia, AIDS, pneumonia, lung cancer, kidney failure, arthritis, COVID pneumonia—all could be reconceived as the results of cells, or systems of cells, functioning abnormally. And all could be perceived as loci of cellular therapies.Filled with writing so vivid, lucid, and suspenseful that complex science becomes thrilling, The Song of the Cell tells the story of how scientists discovered cells, began to understand them, and are now using that knowledge to create new humans. Told in six parts, and laced with Mukherjee’s own experience as a researcher, a doctor, and a prolific reader, The Song of the Cell is both panoramic and intimate—a masterpiece on what it means to be human.“In an account both lyrical and capacious, Mukherjee takes us through an evolution of human from the seventeenth-century discovery that humans are made up of cells to our cutting-edge technologies for manipulating and deploying cells for therapeutic purposes” ( The New Yorker).",3532
The Power of Regret: How Looking Backward Moves Us Forward,ISBN not found,Daniel H. Pink,"Nonfiction, Self Help, Psychology, Personal Development, Audiobook, Science, Business",3.84,"11,745","1,253",239,Hardcover,"First published February 1, 2022","From the #1 New York Times-bestselling author of When and Drive, a new book about the transforming power of our most misunderstood yet potentially most valuable emotion: regret.Everybody has regrets, Daniel H. Pink explains in The Power of Regret. They're a universal and healthy part of being human. And understanding how regret works can help us make smarter decisions, perform better at work and school, and bring greater meaning to our lives.Drawing on research in social psychology, neuroscience, and biology, Pink debunks the myth of the ""no regrets"" philosophy of life. And using the largest sampling of American attitudes about regret ever conducted as well as his own World Regret Survey--which has collected regrets from more than 15,000 people in 105 countries--he lays out the four core regrets that each of us has. These deep regrets offer compelling insights into how we live and how we can find a better path forward.As he did in his bestsellers Drive, When,  and A Whole New Mind,  Pink lays out a dynamic new way of thinking about regret and frames his ideas in ways that are clear, accessible, and pragmatic. Packed with true stories of people's regrets as well as practical takeaways for reimagining regret as a positive force, The Power of Regret shows how we can live richer, more engaged lives.",3513
"Visual Thinking: The Hidden Gifts of People Who Think in Pictures, Patterns, and Abstractions",ISBN not found,Temple Grandin,"Nonfiction, Psychology, Science, Self Help, Autistic Spectrum Disorder, Education, Audiobook",3.63,"2,405",378,340,Hardcover,"First published October 1, 2022","A landmark book that reveals, celebrates, and advocates for the special minds and contributions of visual thinkersA quarter of a century after her memoir, Thinking in Pictures, forever changed how the world understood autism, Temple Grandin—the “anthropologist on Mars,” as Oliver Sacks dubbed her—transforms our awareness of the different ways our brains are wired. Do you have a keen sense of direction, a love of puzzles, the ability to assemble furniture without crying? You are likely a visual thinker.With her genius for demystifying science, Grandin draws on cutting-edge research to take us inside visual thinking. Visual thinkers constitute a far greater proportion of the population than previously believed, she reveals, and a more varied one, from the photo-realistic object visualizers like Grandin herself, with their intuitive knack for design and problem solving, to the abstract, mathematically inclined “visual spatial” thinkers who excel in pattern recognition and systemic thinking. She also makes us understand how a world increasingly geared to the verbal tends to sideline visual thinkers, screening them out at school and passing over them in the workplace. Rather than continuing to waste their singular gifts, driving a collective loss in productivity and innovation, Grandin proposes new approaches to educating, parenting, employing, and collaborating with visual thinkers. In a highly competitive world, this important book helps us see, we need every mind on board.",3469
Stolen Focus: Why You Can't Pay Attention— and How to Think Deeply Again,ISBN not found,Johann Hari,"Nonfiction, Psychology, Self Help, Science, Audiobook, Productivity, Personal Development",4.24,"50,345","5,835",357,Hardcover,"First published January 6, 2022","Our ability to pay attention is collapsing. From the New York Times bestselling author of Chasing the Scream and Lost Connections comes a groundbreaking examination of why this is happening--and how to get our attention back. In the United States, teenagers can focus on one task for only sixty-five seconds at a time, and office workers average only three minutes. Like so many of us, Johann Hari was finding that constantly switching from device to device and tab to tab was a diminishing and depressing way to live. He tried all sorts of self-help solutions--even abandoning his phone for three months--but nothing seemed to work. So Hari went on an epic journey across the world to interview the leading experts on human attention--and he discovered that everything we think we know about this crisis is wrong.We think our inability to focus is a personal failure to exert enough willpower over our devices. The truth is even more disturbing: our focus has been stolen by powerful external forces that have left us uniquely vulnerable to corporations determined to raid our attention for profit. Hari found that there are twelve deep causes of this crisis, from the decline of mind-wandering to rising pollution, all of which have robbed some of our attention. In Stolen Focus,  he introduces readers to Silicon Valley dissidents who learned to hack human attention, and veterinarians who diagnose dogs with ADHD. He explores a favela in Rio de Janeiro where everyone lost their attention in a particularly surreal way, and an office in New Zealand that discovered a remarkable technique to restore workers' productivity.Crucially, Hari learned how we can reclaim our focus--as individuals, and as a society--if we are determined to fight for it. Stolen Focus will transform the debate about attention and finally show us how to get it back.",3257
South to America: A Journey Below the Mason Dixon to Understand the Soul of a Nation,ISBN not found,Imani Perry,"Nonfiction, History, Race, Memoir, Travel, Audiobook, Politics",3.97,"6,429","1,012",410,Hardcover,"First published January 25, 2022","An essential, surprising journey through the history, rituals, and landscapes of the American South—and a revelatory argument for why you must understand the South in order to understand AmericaWe all think we know the South. Even those who have never lived there can rattle off a list of signifiers: the Civil War, Gone with the Wind, the Ku Klux Klan, plantations, football, Jim Crow, slavery. But the idiosyncrasies, dispositions, and habits of the region are stranger and more complex than much of the country tends to acknowledge. In South to America, Imani Perry shows that the meaning of American is inextricably linked with the South, and that our understanding of its history and culture is the key to understanding the nation as a whole.This is the story of a Black woman and native Alabaman returning to the region she has always called home and considering it with fresh eyes. Her journey is full of detours, deep dives, and surprising encounters with places and people. She renders Southerners from all walks of life with sensitivity and honesty, sharing her thoughts about a troubling history and the ritual humiliations and joys that characterize so much of Southern life.Weaving together stories of immigrant communities, contemporary artists, exploitative opportunists, enslaved peoples, unsung heroes, her own ancestors, and her lived experiences, Imani Perry crafts a tapestry unlike any other. With uncommon insight and breathtaking clarity, South to America offers an assertion that if we want to build a more humane future for the United States, we must center our concern below the Mason-Dixon Line.",3116
A Taste for Poison: Eleven Deadly Molecules and the Killers Who Used Them,ISBN not found,Neil Bradbury,"Nonfiction, True Crime, Science, History, Audiobook, Crime, Medicine",4.12,"6,989","1,163",304,Hardcover,"First published February 1, 2022","A brilliant blend of science and crime, 
'A TASTE FOR POISON'
 reveals how eleven notorious poisons affect the body - through the murders in which they were used.As any listener or reader of murder mysteries can tell you, poison is one of the most enduring - and popular - weapons of choice for a scheming murderer. It can be slipped into a drink, smeared onto the tip of an arrow or the handle of a door, even filtered through the air we breathe. But how exactly do these poisons work to break our bodies down, and what can we learn from the damage they inflict?In a fascinating blend of popular science, medical history, and true crime, Dr. Neil Bradbury explores this most morbidly captivating method of murder from a cellular level. Alongside real-life accounts of murderers and their crimes - some notorious, some forgotten, some still unsolved - are the equally compelling stories of the poisons involved: eleven molecules of death that work their way through the human body and, paradoxically, illuminate the way in which our bodies function.Drawn from historical records and current news headlines, A Taste for Poison weaves together the tales of spurned lovers, shady scientists, medical professionals and political assassins to show how the precise systems of the body can be impaired to lethal effect through the use of poison. From the deadly origins of the gin and tonic cocktail to the arsenic-laced wallpaper in Napoleon’s bedroom, 
'A TASTE FOR POISON'
 leads listeners on a riveting tour of the intricate, complex systems that keep us alive - or don’t.",3034
Building a Second Brain: A Proven Method to Organize Your Digital Life and Unlock Your Creative Potential,ISBN not found,Tiago Forte,"Productivity, Nonfiction, Self Help, Personal Development, Business, Psychology, Technology",4.07,"15,533","1,567",272,Hardcover,"First published June 14, 2022",">For the first time in history, we have instantaneous access to the world’s knowledge. There has never been a better time to learn, to contribute, and to improve ourselves. Yet, rather than feeling empowered, we are often left feeling overwhelmed by this constant influx of information. The very knowledge that was supposed to set us free has instead led to the paralyzing stress of believing we’ll never know or remember enough. Now, this eye-opening and accessible guide shows how you can easily create your own personal system for knowledge management, otherwise known as a Second Brain. As a trusted and organized digital repository of your most valued ideas, notes, and creative work synced across all your devices and platforms, a Second Brain gives you the confidence to tackle your most important projects and ambitious goals.  Discover the full potential of your ideas and translate what you know into more powerful, more meaningful improvements in your work and life by Building a Second Brain.",1751
